Probability Concepts,Quantitative Methods,"2023",Level I," Investment decisions are made in a risky environment. The tools that allow us to make decisions with consistency and logic in this setting are based on probability concepts. This reading presents the essential probability tools needed to frame and address many real-world problems involving risk. These tools apply to a variety of issues, such as predicting investment manager performance, forecasting financial variables, and pricing bonds so that they fairly compensate bondholders for default risk. Our focus is practical. We explore the concepts that are most important to investment research and practice. Among these are independence, as it relates to the predictability of returns and financial variables; expectation, as analysts continually look to the future in their analyses and decisions; and variability, variance or dispersion around expectation, as a risk concept important in investments. The reader will acquire specific skills and competencies in using these probability concepts to understand risks and returns on investments.  ","define a random variable, an outcome, and an event;
identify the two defining properties of probability, including mutually exclusive and exhaustive events, and compare and contrast empirical, subjective, and a priori probabilities;
describe the probability of an event in terms of odds for and against the event;
calculate and interpret conditional probabilities;
demonstrate the application of the multiplication and addition rules for probability;
compare and contrast dependent and independent events;
calculate and interpret an unconditional probability using the total probability rule;
calculate and interpret the expected value, variance, and standard deviation of random variables;
explain the use of conditional expectation in investment applications;
interpret a probability tree and demonstrate its application to investment problems;
calculate and interpret the expected value, variance, standard deviation, covariances, and correlations of portfolio returns;
calculate and interpret the covariances of portfolio returns using the joint probability function;
calculate and interpret an updated probability using Bayes’ formula;
identify the most appropriate method to solve a particular counting problem and analyze counting problems using factorial, combination, and permutation concepts.",https://www.cfainstitute.org/-/media/documents/protected/refresher-reading/2023/RR-2023-L1V1R3-probability-concepts.pdf,"A random variable is a quantity whose outcome is uncertain.
Probability is a number between 0 and 1 that describes the chance that a stated event
    will occur.
An event is a specified set of outcomes of a random variable.
Mutually exclusive events can occur only one at a time. Exhaustive events cover or
    contain all possible outcomes.
The two defining properties of a probability are, first, that 0 ≤P(E) ≤ 1 (whereP(E) denotes the probability of an eventE), and second, that the sum of the probabilities of any set of mutually exclusive
    and exhaustive events equals 1.
A probability estimated from data as a relative frequency of occurrence is an empirical
    probability. A probability drawing on personal or subjective judgment is a subjective
    probability. A probability obtained based on logical analysis is an a priori probability.
A probability of an eventE,P(E), can be stated as odds forE=P(E)/[1 −P(E)] or odds againstE= [1 −P(E)]/P(E).
Probabilities that are inconsistent create profit opportunities, according to the
    Dutch Book Theorem.
A probability of an eventnotconditioned on another event is an unconditional probability. The unconditional probability
    of an eventAis denotedP(A). Unconditional probabilities are also called marginal probabilities.
A probability of an event given (conditioned on) another event is a conditional probability.
    The probability of an eventAgiven an eventBis denotedP(A|B), andP(A|B) =P(AB)/P(B),P(B) ≠ 0.
The probability of bothAandBoccurring is the joint probability ofAandB, denotedP(AB).
The multiplication rule for probabilities isP(AB) =P(A|B)P(B).
The probability thatAorBoccurs, or both occur, is denoted byP(AorB).
The addition rule for probabilities isP(AorB) =P(A) +P(B) −P(AB).
When events are independent, the occurrence of one event does not affect the probability
    of occurrence of the other event. Otherwise, the events are dependent.
The multiplication rule for independent events states that ifAandBare independent events,P(AB) =P(A)P(B). The rule generalizes in similar fashion to more than two events.
According to the total probability rule, ifS1,S2, …,Snare mutually exclusive and exhaustive scenarios or events, thenP(A) =P(A|S1)P(S1) +P(A|S2)P(S2) + … +P(A|Sn)P(Sn).
The expected value of a random variable is a probability-weighted average of the possible
    outcomes of the random variable. For a random variableX, the expected value ofXis denotedE(X).
The total probability rule for expected value states thatE(X) =E(X|S1)P(S1) +E(X|S2)P(S2) + … +E(X|Sn)P(Sn), whereS1,S2, …,Snare mutually exclusive and exhaustive scenarios or events.
The variance of a random variable is the expected value (the probability-weighted
    average) of squared deviations from the random variable’s expected valueE(X): σ2(X) =E{[X−E(X)]2}, where σ2(X) stands for the variance ofX.
Variance is a measure of dispersion about the mean. Increasing variance indicates
    increasing dispersion. Variance is measured in squared units of the original variable.
Standard deviation is the positive square root of variance. Standard deviation measures
    dispersion (as does variance), but it is measured in the same units as the variable.
Covariance is a measure of the co-movement between random variables.
The covariance between two random variablesRiandRjin a forward-looking sense is the expected value of the cross-product of the deviations
    of the two random variables from their respective means: Cov(Ri,Rj) =E{[Ri−E(Ri)][Rj−E(Rj)]}. The covariance of a random variable with itself is its own variance.
The historical or sample covariance between two random variablesRiandRjbased on a sample of past data of sizenis the average value of the product of the deviations of observations on two random
    variables from their sample means:Cov(Ri,Rj)=n∑i=1(Ri,t−¯¯¯Ri)(Rj,t−¯¯¯Rj)/(n−1)Cov(Ri,Rj)=∑i=1n(Ri,t−R¯i)(Rj,t−R¯j)/(n−1)
Correlation is a number between −1 and +1 that measures the co-movement (linear association) between two random variables: ρ(Ri,Rj) = Cov(Ri,Rj)/[σ(Ri) σ(Rj)].
If two variables have a very strong linear relation, then the absolute value of their
    correlation will be close to 1. If two variables have a weak linear relation, then
    the absolute value of their correlation will be close to 0.
If the correlation coefficient is positive, the two variables are directly related;
    if the correlation coefficient is negative, the two variables are inversely related.
To calculate the variance of return on a portfolio ofnassets, the inputs needed are thenexpected returns on the individual assets,nvariances of return on the individual assets, andn(n− 1)/2 distinct covariances.
Portfolio variance of return isσ2(Rp)=n∑i=1n∑j=1wiwjCov(Ri,Rj)σ2(Rp)=∑i=1n∑j=1nwiwjCov(Ri,Rj).
The calculation of covariance in a forward-looking sense requires the specification
    of a joint probability function, which gives the probability of joint occurrences
    of values of the two random variables.
When two random variables are independent, the joint probability function is the product
    of the individual probability functions of the random variables.
Bayes’ formula is a method for updating probabilities based on new information.
Bayes’ formula is expressed as follows: Updated probability of event given the new information = [(Probability of the new information given event)/(Unconditional probability of the new information)] × Prior probability of event.
The multiplication rule of counting says, for example, that if the first step in a
    process can be done in 10 ways, the second step, given the first, can be done in 5
    ways, and the third step, given the first two, can be done in 7 ways, then the steps
    can be carried out in (10)(5)(7) = 350 ways.
The number of ways to assign every member of a group of sizentonslots isn! =n(n− 1) (n− 2)(n− 3) … 1. (By convention, 0! = 1.)
The number of ways thatnobjects can be labeled withkdifferent labels, withn1of the first type,n2of the second type, and so on, withn1+n2+ … +nk=n, is given byn!/(n1!n2! …nk!). This expression is the multinomial formula.
A special case of the multinomial formula is the combination formula. The number of
    ways to chooserobjects from a total ofnobjects, when the order in which therobjects are listed does not matter, isnCr=(nr)=n!(n−r)!r!nCr=(nr)=n!(n−r)!r!
The number of ways to chooserobjects from a total ofnobjects, when the order in which therobjects are listed does matter, isnPr=n!(n−r)!nPr=n!(n−r)!This expression is the permutation formula."
