Question,Correct Answer,AIAnswer,
What is the present value formula in terms of the future value (FV) and interest rate (r)?,Option A,Option A,1
The cash conversion cycle for the company is closest to:,Option B,Option C,0
"The only difference between the two projects is that Project 1 is expected to receive larger cash flows early in the life of the project, while Project 2 is expected to receive larger cash flows late in the life of the project. The slope of the NPV profile for Project 1 when compared to the slope of the NPV profile for Project 2 is most likely:",Option C,Option C,1
"Using the bond-yield-plus-risk-premium approach, the cost of equity for the company is closest to:",Option A,Option A,1
"A company’s $100 par perpetual preferred stock has a dividend rate of 7 percent and a required rate of return of 11 percent. The company’s earnings are expected to grow at a constant rate of 3 percent per year. If the market price per share for the preferred stock is $75, the preferred stock is most appropriately described as being:",Option B,Option B,1
An analyst gathers the following information about two companies for the year ending 31 December 2008:,Option A,Option A,1
"What is the joint probability of events A and B, given that the probability of event A is 60% and the probability of event B is 50%?",Option C,Option A,0
"Under which measurement scale is data categorized, but not ranked?",Option B,Option B,1
What does a firm experience when its long-run average cost of production increases by 15% due to an 8% increase in production?,Option B,Option B,1
"If a company has a debt-to-equity ratio of 1.25, and all convertible bonds are converted into shares, what is the company's debt-capital ratio closest to?",Option B,Option D,0
"In finance, what does the Debt/Total capital ratio indicate for a company?",Option B,Option B,1
An analyst has calculated the following ratios for a company:,Option A,Option A,1
"An analyst is developing net present value (NPV) profiles for two investment projects. The only difference between the two projects is that Project 1 is expected to receive larger cash flows early in the life of the project, while Project 2 is expected to receive larger cash flows late in the life of the project. The slope of the NPV profile for Project 1 when compared to the slope of the NPV profile for Project 2 is most likely:",Option B,Option B,1
A company wants to determine the cost of equity to use in the calculation of its weighted average cost of capital. The CFO has gathered the following information:,Option C,Option C,1
"Based on the information provided about the dividend discount model (DDM), what does the value of perpetual preferred stock represent?",Option D,Option B,0
"According to the provided data, how is the expected growth rate of Company 1 compared to Company 2 determined?",Option D,Option D,1
Which behavioral bias is exemplified when an equity analyst tends to misvalue the stocks of popular companies she has recommended and the fund already owns?,Option C,Option C,1
"In order to minimize prepayment risk in a portfolio of mortgage securities, a portfolio manager is most likely to invest in which type of securities?",Option C,Option C,1
"For an out-of-the-money American call option on a stock where the stock price is below the call option strike price, what is the likely value of the time value component of the option?",Option B,Option A,0
What is a primary motivation for investing in commodities based on the data provided?,Option A,Option A,1
Which of the following statements regarding the Markowitz efficient frontier is least likely to be correct based on the given information? The optimal portfolio for:,Option C,Option C,1
"To best comply with the CFA Institute Standards of Professional Conduct (the Standards) related to performance presentation, Somer should modify the:",Option B,Option B,1
"When preparing the marketing materials for the quantitative strategy, did Somer comply with the standard related to communication with clients and prospective clients?",Option A,Option A,1
"If he fills the client’s order for shares of the technology firm, would Somer violate the standard related to priority of transactions?",Option A,Option A,1
What is the meaning of the stated annual interest rate?,Option D,Option D,1
What is the most appropriate method for estimating the intrinsic value of OceanFront based on the provided case information?,Option B,Option B,1
"If the client implements Rousseau’s recommendation, what is the most likely effect on the number of gold futures contracts in his portfolio?",Option A,Option A,1
How is the effective annual rate defined in the context of time value of money?,Option A,Option A,1
What distinguishes an annuity due from an ordinary annuity in financial terms?,Option C,Option C,1
How is the present value of a perpetuity calculated based on the provided information?,Option B,Option B,1
How can the cash flow additivity principle be applied in handling financial problems with uneven cash flows?,Option A,Option A,1
"To best comply with the CFA Institute Standards of Professional Conduct related to performance presentation, Somer should modify the:",Option B,Option C,0
Does Somer’s social media post result in a violation of the Standards?,Option C,Option C,1
"In the context of the time value of money and financial analysis, what does the present value of a perpetuity represent?",Option B,Option B,1
What is the relationship between the interest rate and future value in time value of money calculations?,Option A,Option B,0
Which high-yield credit market from Exhibit 2 would be expected to perform best in the near term?,Option B,Option B,1
How does the credit quality of high-yield bonds impact the expected supply of newly issued bonds in Exhibit 2?,Option B,Option B,1
Which structured financial instrument would best address the preferences of Apollo's client?,Option A,Option A,1
What is the future value factor formula based on the provided data?,Option A,Option A,1
How is the periodic rate defined in the context of interest rates based on the provided data?,Option A,Option A,1
What is the formula for calculating the present value of a perpetuity based on the provided data?,Option B,Option B,1
Did Somer comply with the standard related to communication with clients and prospective clients when preparing marketing materials for the quantitative strategy?,Option A,Option A,1
"What is the relationship between interest rate changes and credit spread changes in non-callable, fixed-rate corporate bonds?",Option C,Option C,1
"In the calculation of expected 6-month excess return for a bond, what does 't' represent?",Option B,Option B,1
Which type of credit market would likely perform best in the near term in a bullish global environment?,Option C,Option D,0
Which of the following structured financial instruments would best address the preferences of Apollo's client?,Option A,Option A,1
Which type of random variable takes on a countable number of possible outcomes that can be listed explicitly?,Option B,Option B,1
"In the context of portfolio optimization and shortfall risk, according to Roy’s safety-first criterion, what is the optimal portfolio that minimizes the probability of the portfolio's return falling below a threshold level?",Option D,Option D,1
"When a random variable follows a lognormal distribution, what is the characteristic of the distribution in terms of its skewness and lower bound?",Option D,Option C,0
What method involves generating a large number of random samples from specified probability distributions to represent the operation of risk in a financial system?,Option C,Option C,1
"The interest rate,r, is the required rate of return; r is also called the discount rate or opportunity cost. What does an interest rate comprise of based on the provided data?",Option D,Option D,1
The cash conversion cycle for the company is closest to:,Option A,Option A,1
An analyst is developing net present value (NPV) profiles for two investment projects. The slope of the NPV profile for Project 1 when compared to the slope of the NPV profile for Project 2 is most likely:,Option C,Option C,1
"Using the bond-yield-plus-risk-premium approach, the cost of equity for the company is closest to:",Option A,Option A,1
"A company's $100 par perpetual preferred stock has a dividend rate of 7 percent and a required rate of return of 11 percent. If the market price per share for the preferred stock is $75, the preferred stock is most appropriately described as being:",Option C,Option D,0
Which of the following best describes the expected growth rate of Company 1 compared to Company 2?,Option B,Option B,1
What is the relation between the interest rate and the future value when determining the future value factor?,Option C,Option C,1
What does the effective annual rate account for in determining the growth of a unit of currency over a year?,Option D,Option D,1
How can annuities be treated to simplify calculations similar to single payments?,Option C,Option C,1
What type of scale categorizes data but does not rank it?,Option B,Option B,1
"In the context of joint probability, if the probability of event A is 60% and the probability of event B is 50%, what is the conditional probability of event A given that event B has occurred?",Option C,Option C,1
"If a firm's long-run average cost of production increases by 15% due to an 8% increase in production, what is the likely scenario the firm is experiencing?",Option B,Option B,1
"If a company with a debt-to-equity ratio of 1.25 has common shareholder's equity of $4,000,000 and $1,000,000 of convertible bonds that can be converted into 50 common shares each, what would be the company's debt-capital ratio if all convertible bonds are converted?",Option B,Option B,1
A company has just issued $5 million of mandatory redeemable preferred shares with a par value of $100 per share and a 7 percent dividend. The issue matures in 5 years. Which of the following statements is least likely correct?,Option A,Option A,1
An analyst gathers the following information about two companies for the year ending 31 December 2008. Which of the following best describes the expected growth rate of Company 1 compared to Company 2?,Option C,Option C,1
An equity analyst working for a growth-oriented mutual fund has a tendency to misvalue stocks of popular companies previously recommended by her. What bias is she most likely exhibiting?,Option C,Option C,1
A portfolio manager wants to minimize prepayment risk in her portfolio while evaluating investments in mortgage securities. What type of investment is she most likely to choose?,Option C,Option C,1
"An investor purchases a 1-month out-of-the-money American call option on a stock, and a week later, the stock price is lower than the call option strike price. What is the most likely time value of the option?",Option B,Option A,0
What is a primary motivation for investment in commodities?,Option A,Option A,1
"When preparing the marketing materials for the quantitative strategy, did Somer comply with the standard related to communication with clients and prospective clients?",Option A,Option D,0
"If he fills the client’s order for shares of the technology firm, would Somer violate the standard related to priority of transactions?",Option A,Option C,0
"In time value of money problems, which factor can be used to handle annuities similarly as single payments?",Option B,Option B,1
"In a perpetuity, what is the formula to calculate the present value where A represents the periodic payment?",Option B,Option B,1
What type of cash flow consists of a finite set of level sequential cash flows?,Option B,Option B,1
"How is the interest rate, r, defined in the context of time value of money?",Option A,Option A,1
What is the future value factor formula based on the provided data?,Option B,Option B,1
What is the correct formula for calculating the present value of a perpetuity based on the provided data?,Option C,Option C,1
Which statement accurately describes the relationship between the stated annual interest rate and the periodic rate in the context of the provided data?,Option C,Option C,1
"How is the Adjusted Funds From Operations (AFFO) per share calculated for Autier REIT over the last 12 months, based on the provided data?",Option A,Option B,0
The most appropriate method for estimating the intrinsic value of OceanFront is based on:,Option B,Option B,1
"If the client implements Rousseau’s recommendation, the number of gold futures contracts in his portfolio will most likely:",Option A,Option C,0
What is the term used for the amount by which a unit of currency will grow in a year with interest on interest included?,Option B,Option B,1
What should Somer modify to best comply with the CFA Institute Standards of Professional Conduct related to performance presentation?,Option A,Option B,0
Does Somer’s social media post result in a violation of the Standards?,Option C,Option C,1
Which of the following premiums compensates lenders for the risk in an interest rate?,Option C,Option C,1
"According to the data provided, which premium compensates lenders for the risk associated with the time value of money?",Option D,Option D,1
"In time value of money problems, how is the future value (FV) calculated?",Option B,Option B,1
What is the present value (PV) of a perpetuity based on the provided data?,Option A,Option A,1
How are annuities different from single payments when analyzing time value of money?,Option B,Option B,1
What is the relationship between the interest rate and future value in the context of time value of money analysis?,Option A,Option A,1
How can annuities be handled in time value of money problems to simplify calculations?,Option D,Option D,1
"In the context of time value of money analysis, what is the present value of a perpetuity formula based on?",Option C,Option C,1
"According to the provided data, how should members and candidates inform clients about the investment process in compliance with the standard related to communication?",Option B,Option B,1
What can an interest rate be viewed as incorporating in addition to the real risk-free interest rate?,Option B,Option B,1
"When dealing with non-callable, fixed-rate corporate bonds, what is the relationship between spread duration and modified duration likely to be?",Option C,Option C,1
How can the expected 6-month excess return for a bond be estimated based on spread duration and other factors?,Option B,Option B,1
"Considering various high-yield credit markets, which market would be expected to perform best in a bullish global environment?",Option C,Option D,0
What financial instrument would best suit the preferences of Apollo's client in the given context?,Option A,Option A,1
"Under which measurement scale is data categorized, but not ranked?",Option B,Option B,1
Which measurement scale categorizes data but does not rank it?,Option B,Option B,1
,,,83
